{
  "version": "2026-09-02",
  "dimensions": [
    { "id": "adaptation", "label": "Adaptation", "question": "When is flexibility wisdom, and when is it surrender?" },
    { "id": "agency", "label": "Agency", "question": "Who is acting, and who is being used as an instrument?" },
    { "id": "legitimacy", "label": "Legitimacy", "question": "Why do people accept someone's right to rule?" },
    { "id": "mastery", "label": "Mastery", "question": "What does earned competence require—and what can imitate it?" },
    { "id": "power", "label": "Power", "question": "Who benefits, who pays, and who gets to define the game?" },
    { "id": "representation", "label": "Representation", "question": "How faithfully does a system turn people into voice?" },
    { "id": "absurdity", "label": "Absurdity", "question": "How do we remain human inside systems that refuse to make sense?" },
    { "id": "otherness", "label": "Otherness", "question": "What happens when we meet a mind, culture, or model unlike our own?" }
  ],
  "nodes": [
    {
      "id": "believe",
      "title": "I Want to Believe",
      "eyebrow": "Thought 01",
      "type": "thought",
      "status": "published",
      "url": "../i-want-to-believe/",
      "summary": "Spielberg, Disclosure Day, and the hopeful danger of mistaking our model of the world for the world itself.",
      "question": "Can wonder survive contact with an intelligence that does not share our categories?",
      "minutes": 9,
      "tags": ["Spielberg", "disclosure", "models", "science fiction", "optimism"],
      "dimensions": { "otherness": 1, "adaptation": 0.55, "agency": 0.45, "absurdity": 0.4 },
      "position": { "x": 12, "y": 19 }
    },
    {
      "id": "odyssey",
      "title": "A Faithful Betrayal of Homer",
      "eyebrow": "Odyssey · Part 1 · Prologue",
      "type": "thought",
      "status": "published",
      "url": "../fuzzy-logic-of-nolans-odyssey/",
      "summary": "The Ship of Theseus, the Sorites paradox, and why nobody comes home unchanged.",
      "question": "How much can a story change and still be itself?",
      "minutes": 7,
      "tags": ["Nolan","Odyssey","adaptation","zeitgeist","myth"],
      "dimensions": {"adaptation":1,"otherness":0.45,"legitimacy":0.35,"agency":0.55},
      "position": {"x":22,"y":48}
    },
    {
      "id": "odyssey-taxidermy",
      "title": "Taxidermy Is Not Authenticity",
      "eyebrow": "Odyssey · Part 2",
      "type": "thought",
      "status": "published",
      "url": "../taxidermy-is-not-authenticity/",
      "summary": "A living tradition survives by changing shape. A dead one survives by being labeled correctly.",
      "question": "What should an adaptation preserve: events, values, or the work a story does?",
      "minutes": 10,
      "tags": ["Nolan","Odyssey","adaptation","fidelity","myth"],
      "dimensions": {"adaptation":1,"otherness":0.6,"legitimacy":0.45},
      "position": {"x":7,"y":40}
    },
    {
      "id": "odyssey-horse",
      "title": "The Horse Was Made of Trust",
      "eyebrow": "Odyssey · Part 3",
      "type": "thought",
      "status": "published",
      "url": "../the-horse-was-made-of-trust/",
      "summary": "Odysseus turns trust into a weapon, and victory becomes a question of responsibility.",
      "question": "What survives a victory when winning becomes the only rule?",
      "minutes": 13,
      "tags": ["Nolan","Odyssey","trust","agency","adaptation"],
      "dimensions": {"agency":1,"adaptation":0.85,"power":0.95,"legitimacy":0.9},
      "position": {"x":37,"y":55}
    },
    {
      "id": "odysseus-ajax",
      "title": "Many-Turning, Never-Bending",
      "eyebrow": "Planned Thought",
      "type": "thought",
      "status": "planned",
      "summary": "Odysseus and Ajax as competing selves: strategic adaptation against uncompromising principle.",
      "question": "How do you win the game without becoming what the game rewards?",
      "minutes": 8,
      "tags": ["Odysseus", "Ajax", "archetypes", "tragedy", "identity"],
      "dimensions": { "adaptation": 1, "agency": 0.9, "mastery": 0.6, "power": 0.45 },
      "position": { "x": 43, "y": 31 }
    },
    {
      "id": "agile",
      "title": "Agile Is a Theory of Knowledge",
      "eyebrow": "Planned Thought",
      "type": "thought",
      "status": "planned",
      "summary": "Agile works when it is a disciplined response to uncertainty, not a calendar full of renamed meetings.",
      "question": "What if adaptation is not the absence of principle but a principle about incomplete knowledge?",
      "minutes": 6,
      "tags": ["Agile", "uncertainty", "delivery", "learning", "adaptation"],
      "dimensions": { "adaptation": 1, "mastery": 0.8, "agency": 0.65, "power": 0.35 },
      "position": { "x": 65, "y": 21 }
    },
    {
      "id": "hard-things",
      "title": "Choose the Right Hard Thing",
      "eyebrow": "Planned Thought",
      "type": "thought",
      "status": "planned",
      "summary": "Mastery grows through chosen difficulty; impostor syndrome and false confidence are both failures to read the evidence clearly.",
      "question": "Which difficulty produces capability, and which merely performs suffering?",
      "minutes": 8,
      "tags": ["mastery", "impostor syndrome", "Dunning-Kruger", "practice", "career"],
      "dimensions": { "mastery": 1, "adaptation": 0.75, "agency": 0.8, "power": 0.25 },
      "position": { "x": 82, "y": 38 }
    },
    {
      "id": "reverse-centaurs",
      "title": "Which Half Is the Horse?",
      "eyebrow": "Planned Thought",
      "type": "thought",
      "status": "planned",
      "summary": "Automation can extend human judgment—or conscript humans into serving the machine's blind spots.",
      "question": "Does the tool enlarge human agency, or does the human become its error-handling subsystem?",
      "minutes": 8,
      "tags": ["reverse centaurs", "automation", "AI", "labor", "Doctorow"],
      "dimensions": { "agency": 1, "power": 1, "mastery": 0.75, "adaptation": 0.6 },
      "position": { "x": 70, "y": 62 }
    },
    {
      "id": "congress",
      "title": "The People's House Got Too Small",
      "eyebrow": "Planned Thought",
      "type": "thought",
      "status": "planned",
      "summary": "A systems-level exploration of House size, proportional voice, districting, terms, age cohorts, and electoral incentives.",
      "question": "What would representation look like if we designed it for the represented?",
      "minutes": 12,
      "tags": ["Congress", "representation", "electoral reform", "districts", "institutions"],
      "dimensions": { "representation": 1, "legitimacy": 0.9, "power": 0.9, "agency": 0.65 },
      "position": { "x": 85, "y": 78 }
    },
    {
      "id": "right-to-rule",
      "title": "Who Has the Right to Rule?",
      "eyebrow": "Planned Thought",
      "type": "thought",
      "status": "planned",
      "summary": "From Aragorn to Paul Atreides, stories teach us to recognize legitimate kings and applaud charismatic tyrants—sometimes in the same breath.",
      "question": "Why does inherited authority feel safer than revolutionary charisma until it suddenly doesn't?",
      "minutes": 10,
      "tags": ["Dune", "LOTR", "Red Rising", "Wheel of Time", "legitimacy"],
      "dimensions": { "legitimacy": 1, "power": 0.95, "representation": 0.65, "agency": 0.55 },
      "position": { "x": 51, "y": 83 }
    },
    {
      "id": "dont-panic",
      "title": "Don't Panic Is an Ethical System",
      "eyebrow": "Planned Thought",
      "type": "thought",
      "status": "planned",
      "summary": "Douglas Adams makes grace under cosmic nonsense feel less like denial and more like moral style.",
      "question": "What do we owe one another when the universe refuses to supply a sensible plot?",
      "minutes": 6,
      "tags": ["Douglas Adams", "absurdity", "grace", "humor", "meaning"],
      "dimensions": { "absurdity": 1, "agency": 0.7, "otherness": 0.55, "adaptation": 0.6 },
      "position": { "x": 20, "y": 83 }
    },
    {
      "id": "maps-models",
      "title": "The Map Is Not the Territory",
      "eyebrow": "Concept",
      "type": "concept",
      "status": "reference",
      "summary": "Every model clarifies by leaving something out; trouble begins when usefulness hardens into certainty.",
      "question": "Which parts of reality did this useful model teach us not to see?",
      "minutes": 3,
      "tags": ["epistemology", "models", "uncertainty", "categories"],
      "dimensions": { "otherness": 0.9, "adaptation": 0.85, "mastery": 0.65 },
      "position": { "x": 8, "y": 52 }
    },
    {
      "id": "principled-adaptation",
      "title": "Principled Adaptation",
      "eyebrow": "Concept",
      "type": "concept",
      "status": "reference",
      "summary": "Hold values firmly, hypotheses lightly, and tactics loosely enough to learn from contact with reality.",
      "question": "What must remain fixed so that everything else can change?",
      "minutes": 3,
      "tags": ["principle", "adaptation", "learning", "integrity"],
      "dimensions": { "adaptation": 1, "agency": 0.75, "mastery": 0.7 },
      "position": { "x": 48, "y": 52 }
    },
    {
      "id": "earned-competence",
      "title": "Earned Competence",
      "eyebrow": "Concept",
      "type": "concept",
      "status": "reference",
      "summary": "Capability is evidence accumulated through repeated contact with consequential work, not merely a credential or a feeling.",
      "question": "What evidence should count when formal channels and actual ability disagree?",
      "minutes": 3,
      "tags": ["competence", "practice", "credentials", "judgment"],
      "dimensions": { "mastery": 1, "agency": 0.75, "adaptation": 0.65 },
      "position": { "x": 92, "y": 18 }
    },
    {
      "id": "human-agency",
      "title": "Human Agency",
      "eyebrow": "Concept",
      "type": "concept",
      "status": "reference",